{
  "confirmed_reuse_bindings": [
    "page_candidate_rag_mock_adapter -> page-analysis-mcp/search_page_candidates",
    "user_flow_analysis_mock_adapter -> page-analysis-mcp/analyze_user_flow",
    "behavior_scenario_recommendation_mock_adapter -> page-analysis-mcp/recommend_behavior_scenarios",
    "page_customer_sql_analysis_mock_adapter -> page-analysis-mcp/execute_page_customer_sql"
  ],
  "proposed_shared_agents": [
    "customer_behavior_type_classifier_agent",
    "page_selection_decision_agent",
    "workflow2_page_handoff_agent"
  ],
  "proposed_adapter_catalog_entries": [
    "page_candidate_rag_mock_adapter",
    "user_flow_analysis_mock_adapter",
    "behavior_scenario_recommendation_mock_adapter",
    "page_customer_sql_analysis_mock_adapter"
  ],
  "proposed_workflow_reuse": [
    "page_selection_analysis_workflow"
  ],
  "remote_a2a_contracts": [],
  "deferred_reuse": [
    "workflow2 exact handoff schema"
  ],
  "rejected_reuse": [
    "Remote A2A boundary was not created because no independent remote agent contract was supplied."
  ]
}
